text,language
" Nature, in the broadest sense, is the natural, physical, material world or universe.",english
"""Nature"" can refer to the phenomena of the physical world, and also to life in general.",english
"The study of nature is a large, if not the only, part of science.",english
"Although humans are part of nature, human activity is often understood as a separate category from other natural phenomena.",english
"[1] The word nature is borrowed from the Old French nature and is derived from the Latin word natura, or ""essential qualities, innate disposition"", and in ancient times, literally meant ""birth"".",english
"[2] In ancient philosophy, natura is mostly used as the Latin translation of the Greek word physis (φύσις), which originally related to the intrinsic characteristics that plants, animals, and other features of the world develop of their own accord.",english
"[3][4] 
The concept of nature as a whole, the physical universe, is one of several expansions of the original notion;[1] it began with certain core applications of the word φύσις by pre-Socratic philosophers (though this word had a dynamic dimension then, especially for Heraclitus), and has steadily gained currency ever since.",english
"During the advent of modern scientific method in the last several centuries, nature became the passive reality, organized and moved by divine laws.",english
"[5][6] With the Industrial revolution, nature increasingly became seen as the part of reality deprived from intentional intervention : it was hence considered as sacred by some traditions (Rousseau, American transcendentalism) or a mere decorum for divine providence or human history (Hegel, Marx).",english
"However, a vitalist vision of nature, closer to the presocratic one, got reborn at the same time, especially after Charles Darwin.",english
"[1] Within the various uses of the word today, ""nature"" often refers to geology and wildlife.",english
"Nature can refer to the general realm of living plants and animals, and in some cases to the processes associated with inanimate objects—the way that particular types of things exist and change of their own accord, such as the weather and geology of the Earth.",english
"It is often taken to mean the ""natural environment"" or wilderness—wild animals, rocks, forest, and in general those things that have not been substantially altered by human intervention, or which persist despite human intervention.",english
"For example, manufactured objects and human interaction generally are not considered part of nature, unless qualified as, for example, ""human nature"" or ""the whole of nature"".",english
"This more traditional concept of natural things that can still be found today implies a distinction between the natural and the artificial, with the artificial being understood as that which has been brought into being by a human consciousness or a human mind.",english
"Depending on the particular context, the term ""natural"" might also be distinguished from the unnatural or the supernatural.",english
"[1] Earth is the only planet known to support life, and its natural features are the subject of many fields of scientific research.",english
"Within the solar system, it is third closest to the sun; it is the largest terrestrial planet and the fifth largest overall.",english
"Its most prominent climatic features are its two large polar regions, two relatively narrow temperate zones, and a wide equatorial tropical to subtropical region.",english
"[7] Precipitation varies widely with location, from several metres of water per year to less than a millimetre.",english
71 percent of the Earth's surface is covered by salt-water oceans.,english
"The remainder consists of continents and islands, with most of the inhabited land in the Northern Hemisphere.",english
Earth has evolved through geological and biological processes that have left traces of the original conditions.,english
The outer surface is divided into several gradually migrating tectonic plates.,english
"The interior remains active, with a thick layer of plastic mantle and an iron-filled core that generates a magnetic field.",english
"This iron core is composed of a solid inner phase, and a fluid outer phase.",english
"Convective motion in the core generates electric currents through dynamo action, and these, in turn, generate the geomagnetic field.",english
"The atmospheric conditions have been significantly altered from the original conditions by the presence of life-forms,[8] which create an ecological balance that stabilizes the surface conditions.",english
"Despite the wide regional variations in climate by latitude and other geographic factors, the long-term average global climate is quite stable during interglacial periods,[9] and variations of a degree or two of average global temperature have historically had major effects on the ecological balance, and on the actual geography of the Earth.",english
[10][11] Geology is the science and study of the solid and liquid matter that constitutes the earth.,english
"The field of geology encompasses the study of the composition, structure, physical properties, dynamics, and history of Earth materials, and the processes by which they are formed, moved, and changed.",english
"The field is a major academic discipline, and is also important for mineral and hydrocarbon extraction, knowledge about and mitigation of natural hazards, some Geotechnical engineering fields, and understanding past climates and environments.",english
The geology of an area evolves through time as rock units are deposited and inserted and deformational processes change their shapes and locations.,english
Rock units are first emplaced either by deposition onto the surface or intrude into the overlying rock.,english
"Deposition can occur when sediments settle onto the surface of the Earth and later lithify into sedimentary rock, or when as volcanic material such as volcanic ash or lava flows, blanket the surface.",english
"Igneous intrusions such as batholiths, laccoliths, dikes, and sills, push upwards into the overlying rock, and crystallize as they intrude.",english
"After the initial sequence of rocks has been deposited, the rock units can be deformed and/or metamorphosed.",english
"Deformation typically occurs as a result of horizontal shortening, horizontal extension, or side-to-side (strike-slip) motion.",english
"These structural regimes broadly relate to convergent boundaries, divergent boundaries, and transform boundaries, respectively, between tectonic plates.",english
"Earth is estimated to have formed 4.54 billion years ago from the solar nebula, along with the Sun and other planets.",english
[12] The moon formed roughly 20 million years later.,english
"Initially molten, the outer layer of the Earth cooled, resulting in the solid crust.",english
Outgassing and volcanic activity produced the primordial atmosphere.,english
"Condensing water vapor, most or all of which came from ice delivered by comets, produced the oceans and other water sources.",english
[13] The highly energetic chemistry is believed to have produced a self-replicating molecule around 4 billion years ago.,english
"[14] Continents formed, then broke up and reformed as the surface of Earth reshaped over hundreds of millions of years, occasionally combining to make a supercontinent.",english
"Roughly 750 million years ago, the earliest known supercontinent Rodinia, began to break apart.",english
"The continents later recombined to form Pannotia which broke apart about 540 million years ago, then finally Pangaea, which broke apart about 180 million years ago.",english
"[16] During the Neoproterozoic era, freezing temperatures covered much of the Earth in glaciers and ice sheets.",english
"This hypothesis has been termed the ""Snowball Earth"", and it is of particular interest as it precedes the Cambrian explosion in which multicellular life forms began to proliferate about 530–540 million years ago.",english
[17] Since the Cambrian explosion there have been five distinctly identifiable mass extinctions.,english
"[18] The last mass extinction occurred some 66 million years ago, when a meteorite collision probably triggered the extinction of the non-avian dinosaurs and other large reptiles, but spared small animals such as mammals.",english
"Over the past 66 million years, mammalian life diversified.",english
"[19] Several million years ago, a species of small African ape gained the ability to stand upright.",english
"[15] The subsequent advent of human life, and the development of agriculture and further civilization allowed humans to affect the Earth more rapidly than any previous life form, affecting both the nature and quantity of other organisms as well as global climate.",english
"By comparison, the Great Oxygenation Event, produced by the proliferation of algae during the Siderian period, required about 300 million years to culminate.",english
"The present era is classified as part of a mass extinction event, the Holocene extinction event, the fastest ever to have occurred.",english
"[20][21] Some, such as E. O. Wilson of Harvard University, predict that human destruction of the biosphere could cause the extinction of one-half of all species in the next 100 years.",english
"[22] The extent of the current extinction event is still being researched, debated and calculated by biologists.",english
[23][24][25] The Earth's atmosphere is a key factor in sustaining the ecosystem.,english
The thin layer of gases that envelops the Earth is held in place by gravity.,english
"Air is mostly nitrogen, oxygen, water vapor, with much smaller amounts of carbon dioxide, argon, etc.",english
The atmospheric pressure declines steadily with altitude.,english
The ozone layer plays an important role in depleting the amount of ultraviolet (UV) radiation that reaches the surface.,english
"As DNA is readily damaged by UV light, this serves to protect life at the surface.",english
"The atmosphere also retains heat during the night, thereby reducing the daily temperature extremes.",english
"Terrestrial weather occurs almost exclusively in the lower part of the atmosphere, and serves as a convective system for redistributing heat.",english
"[26] Ocean currents are another important factor in determining climate, particularly the major underwater thermohaline circulation which distributes heat energy from the equatorial oceans to the polar regions.",english
These currents help to moderate the differences in temperature between winter and summer in the temperate zones.,english
"Also, without the redistributions of heat energy by the ocean currents and atmosphere, the tropics would be much hotter, and the polar regions much colder.",english
Weather can have both beneficial and harmful effects.,english
"Extremes in weather, such as tornadoes or hurricanes and cyclones, can expend large amounts of energy along their paths, and produce devastation.",english
"Surface vegetation has evolved a dependence on the seasonal variation of the weather, and sudden changes lasting only a few years can have a dramatic effect, both on the vegetation and on the animals which depend on its growth for their food.",english
Climate is a measure of the long-term trends in the weather.,english
"Various factors are known to influence the climate, including ocean currents, surface albedo, greenhouse gases, variations in the solar luminosity, and changes to the Earth's orbit.",english
"Based on historical records, the Earth is known to have undergone drastic climate changes in the past, including ice ages.",english
"The climate of a region depends on a number of factors, especially latitude.",english
A latitudinal band of the surface with similar climatic attributes forms a climate region.,english
"There are a number of such regions, ranging from the tropical climate at the equator to the polar climate in the northern and southern extremes.",english
"Weather is also influenced by the seasons, which result from the Earth's axis being tilted relative to its orbital plane.",english
"Thus, at any given time during the summer or winter, one part of the Earth is more directly exposed to the rays of the sun.",english
This exposure alternates as the Earth revolves in its orbit.,english
"At any given time, regardless of season, the northern and southern hemispheres experience opposite seasons.",english
"Weather is a chaotic system that is readily modified by small changes to the environment, so accurate weather forecasting is limited to only a few days.",english
"[27] Overall, two things are happening worldwide: (1) temperature is increasing on the average; and (2) regional climates have been undergoing noticeable changes.",english
[28] Water is a chemical substance that is composed of hydrogen and oxygen (H2O) and is vital for all known forms of life.,english
"[29] In typical usage, water refers only to its liquid form or state, but the substance also has a solid state, ice, and a gaseous state, water vapor, or steam.",english
Water covers 71% of the Earth's surface.,english
"[30] On Earth, it is found mostly in oceans and other large bodies of water, with 1.6% of water below ground in aquifers and 0.001% in the air as vapor, clouds, and precipitation.",english
"[31][32] Oceans hold 97% of surface water, glaciers, and polar ice caps 2.4%, and other land surface water such as rivers, lakes, and ponds 0.6%.",english
"Additionally, a minute amount of the Earth's water is contained within biological bodies and manufactured products.",english
"An ocean is a major body of saline water, and a principal component of the hydrosphere.",english
"Approximately 71% of the Earth's surface (an area of some 361 million square kilometers) is covered by ocean, a continuous body of water that is customarily divided into several principal oceans and smaller seas.",english
"More than half of this area is over 3,000 meters (9,800 feet) deep.",english
"Average oceanic salinity is around 35 parts per thousand (ppt) (3.5%), and nearly all seawater has a salinity in the range of 30 to 38 ppt.",english
"Though generally recognized as several 'separate' oceans, these waters comprise one global, interconnected body of salt water often referred to as the World Ocean or global ocean.",english
[33][34] This concept of a global ocean as a continuous body of water with relatively free interchange among its parts is of fundamental importance to oceanography.,english
"[35] The major oceanic divisions are defined in part by the continents, various archipelagos, and other criteria: these divisions are (in descending order of size) the Pacific Ocean, the Atlantic Ocean, the Indian Ocean, the Southern Ocean, and the Arctic Ocean.",english
"Smaller regions of the oceans are called seas, gulfs, bays and other names.",english
"There are also salt lakes, which are smaller bodies of landlocked saltwater that are not interconnected with the World Ocean.",english
Two notable examples of salt lakes are the Aral Sea and the Great Salt Lake.,english
"A lake (from Latin word lacus) is a terrain feature (or physical feature), a body of liquid on the surface of a world that is localized to the bottom of basin (another type of landform or terrain feature; that is, it is not global) and moves slowly if it moves at all.",english
"On Earth, a body of water is considered a lake when it is inland, not part of the ocean, is larger and deeper than a pond, and is fed by a river.",english
"[36][37] The only world other than Earth known to harbor lakes is Titan, Saturn's largest moon, which has lakes of ethane, most likely mixed with methane.",english
"It is not known if Titan's lakes are fed by rivers, though Titan's surface is carved by numerous river beds.",english
"Natural lakes on Earth are generally found in mountainous areas, rift zones, and areas with ongoing or recent glaciation.",english
Other lakes are found in endorheic basins or along the courses of mature rivers.,english
"In some parts of the world, there are many lakes because of chaotic drainage patterns left over from the last Ice Age.",english
"All lakes are temporary over geologic time scales, as they will slowly fill in with sediments or spill out of the basin containing them.",english
"A pond is a body of standing water, either natural or man-made, that is usually smaller than a lake.",english
"A wide variety of man-made bodies of water are classified as ponds, including water gardens designed for aesthetic ornamentation, fish ponds designed for commercial fish breeding, and solar ponds designed to store thermal energy.",english
Ponds and lakes are distinguished from streams via current speed.,english
"While currents in streams are easily observed, ponds and lakes possess thermally driven micro-currents and moderate wind driven currents.",english
"These features distinguish a pond from many other aquatic terrain features, such as stream pools and tide pools.",english
"A river is a natural watercourse,[38] usually freshwater, flowing towards an ocean, a lake, a sea or another river.",english
"In a few cases, a river simply flows into the ground or dries up completely before reaching another body of water.",english
"Small rivers may also be called by several other names, including stream, creek, brook, rivulet, and rill; there is no general rule that defines what can be called a river.",english
Many names for small rivers are specific to geographic location; one example is Burn in Scotland and North-east England.,english
"Sometimes a river is said to be larger than a creek, but this is not always the case, due to vagueness in the language.",english
[39] A river is part of the hydrological cycle.,english
"Water within a river is generally collected from precipitation through surface runoff, groundwater recharge, springs, and the release of stored water in natural ice and snowpacks (i.e., from glaciers).",english
"A stream is a flowing body of water with a current, confined within a bed and stream banks.",english
"In the United States, a stream is classified as a watercourse less than 60 feet (18 metres) wide.",english
"Streams are important as conduits in the water cycle, instruments in groundwater recharge, and they serve as corridors for fish and wildlife migration.",english
The biological habitat in the immediate vicinity of a stream is called a riparian zone.,english
"Given the status of the ongoing Holocene extinction, streams play an important corridor role in connecting fragmented habitats and thus in conserving biodiversity.",english
"The study of streams and waterways in general involves many branches of inter-disciplinary natural science and engineering, including hydrology, fluvial geomorphology, aquatic ecology, fish biology, riparian ecology, and others.",english
Ecosystems are composed of a variety of biotic and abiotic components that function in an interrelated way.,english
[41] The structure and composition is determined by various environmental factors that are interrelated.,english
Variations of these factors will initiate dynamic modifications to the ecosystem.,english
"Some of the more important components are soil, atmosphere, radiation from the sun, water, and living organisms.",english
Central to the ecosystem concept is the idea that living organisms interact with every other element in their local environment.,english
"Eugene Odum, a founder of ecology, stated: ""Any unit that includes all of the organisms (ie: the ""community"") in a given area interacting with the physical environment so that a flow of energy leads to clearly defined trophic structure, biotic diversity, and material cycles (i.e.",english
: exchange of materials between living and nonliving parts) within the system is an ecosystem.,english
"""[42] Within the ecosystem, species are connected and dependent upon one another in the food chain, and exchange energy and matter between themselves as well as with their environment.",english
"[43] The human ecosystem concept is based on the human/nature dichotomy and the idea that all species are ecologically dependent on each other, as well as with the abiotic constituents of their biotope.",english
[44] A smaller unit of size is called a microecosystem.,english
"For example, a microsystem can be a stone and all the life under it.",english
"A macroecosystem might involve a whole ecoregion, with its drainage basin.",english
[45] Wilderness is generally defined as areas that have not been significantly modified by human activity.,english
"Wilderness areas can be found in preserves, estates, farms, conservation preserves, ranches, national forests, national parks, and even in urban areas along rivers, gulches, or otherwise undeveloped areas.",english
"Wilderness areas and protected parks are considered important for the survival of certain species, ecological studies, conservation, and solitude.",english
"Some nature writers believe wilderness areas are vital for the human spirit and creativity,[46] and some ecologists consider wilderness areas to be an integral part of the Earth's self-sustaining natural ecosystem (the biosphere).",english
"They may also preserve historic genetic traits and that they provide habitat for wild flora and fauna that may be difficult or impossible to recreate in zoos, arboretums, or laboratories.",english
"Although there is no universal agreement on the definition of life, scientists generally accept that the biological manifestation of life is characterized by organization, metabolism, growth, adaptation, response to stimuli, and reproduction.",english
[47] Life may also be said to be simply the characteristic state of organisms.,english
"Properties common to terrestrial organisms (plants, animals, fungi, protists, archaea, and bacteria) are that they are cellular, carbon-and-water-based with complex organization, having a metabolism, a capacity to grow, respond to stimuli, and reproduce.",english
An entity with these properties is generally considered life.,english
"However, not every definition of life considers all of these properties to be essential.",english
Human-made analogs of life may also be considered to be life.,english
"The biosphere is the part of Earth's outer shell—including land, surface rocks, water, air and the atmosphere—within which life occurs, and which biotic processes in turn alter or transform.",english
"From the broadest geophysiological point of view, the biosphere is the global ecological system integrating all living beings and their relationships, including their interaction with the elements of the lithosphere (rocks), hydrosphere (water), and atmosphere (air).",english
"The entire Earth contains over 75 billion tons (150 trillion pounds or about 6.8×1013 kilograms) of biomass (life), which lives within various environments within the biosphere.",english
"[48] Over nine-tenths of the total biomass on Earth is plant life, on which animal life depends very heavily for its existence.",english
"[49] More than 2 million species of plant and animal life have been identified to date,[50] and estimates of the actual number of existing species range from several million to well over 50 million.",english
"[51][52][53] The number of individual species of life is constantly in some degree of flux, with new species appearing and others ceasing to exist on a continual basis.",english
[54][55] The total number of species is in rapid decline.,english
"[56][57][58] The origin of life on Earth is not well understood, but it is known to have occurred at least 3.5 billion years ago,[61][62][63] during the hadean or archean eons on a primordial Earth that had a substantially different environment than is found at present.",english
[64] These life forms possessed the basic traits of self-replication and inheritable traits.,english
"Once life had appeared, the process of evolution by natural selection resulted in the development of ever-more diverse life forms.",english
Species that were unable to adapt to the changing environment and competition from other life forms became extinct.,english
"However, the fossil record retains evidence of many of these older species.",english
Current fossil and DNA evidence shows that all existing species can trace a continual ancestry back to the first primitive life forms.,english
[64] When basic forms of plant life developed the process of photosynthesis the sun's energy could be harvested to create conditions which allowed for more complex life forms.,english
[65] The resultant oxygen accumulated in the atmosphere and gave rise to the ozone layer.,english
The incorporation of smaller cells within larger ones resulted in the development of yet more complex cells called eukaryotes.,english
"[66] Cells within colonies became increasingly specialized, resulting in true multicellular organisms.",english
"With the ozone layer absorbing harmful ultraviolet radiation, life colonized the surface of Earth.",english
"The first form of life to develop on the Earth were microbes, and they remained the only form of life until about a billion years ago when multi-cellular organisms began to appear.",english
"[67] Microorganisms are single-celled organisms that are generally microscopic, and smaller than the human eye can see.",english
"They include Bacteria, Fungi, Archaea, and Protista.",english
"These life forms are found in almost every location on the Earth where there is liquid water, including in the Earth's interior.",english
"[68]
Their reproduction is both rapid and profuse.",english
"The combination of a high mutation rate and a horizontal gene transfer[69] ability makes them highly adaptable, and able to survive in new environments, including outer space.",english
[70] They form an essential part of the planetary ecosystem.,english
"However, some microorganisms are pathogenic and can post health risk to other organisms.",english
