text,language
"[77] Seigenthaler, the founding editorial director of USA Today and founder of the Freedom Forum First Amendment Center at Vanderbilt University, called Wikipedia co-founder Jimmy Wales and asked whether he had any way of knowing who contributed the misinformation.",english
"Wales replied that he did not, although the perpetrator was eventually traced.",english
"[78][79] After the incident, Seigenthaler described Wikipedia as ""a flawed and irresponsible research tool"".",english
"[77] This incident led to policy changes at Wikipedia, specifically targeted at tightening up the verifiability of biographical articles of living people.",english
"[80] In 2010, Daniel Tosh encouraged viewers of his show, Tosh.0, to visit the show's Wikipedia article and edit it at will.",english
"On a later episode, he commented on the edits to the article, most of them offensive, which had been made by the audience and had prompted the article to be locked from editing.",english
"[81][82] Wikipedians often have disputes regarding content, which may result in repeatedly making opposite changes to an article, known as ""edit warring"".",english
[83][84] The process is widely seen as a resource-consuming scenario where no useful knowledge is added.,english
"[85] This practice is also criticized as creating a competitive,[86] conflict based[87] editing culture associated with traditional masculine gender roles,[88] which contributes to the gender bias on Wikipedia.",english
Special interest groups have engaged in edit wars to advance their own political interests.,english
"Content in Wikipedia is subject to the laws (in particular, copyright laws) of the United States and of the US state of Virginia, where the majority of Wikipedia's servers are located.",english
"Beyond legal matters, the editorial principles of Wikipedia are embodied in the ""five pillars"" and in numerous policies and guidelines intended to appropriately shape content.",english
"Even these rules are stored in wiki form, and Wikipedia editors write and revise the website's policies and guidelines.",english
[89] Editors can enforce these rules by deleting or modifying non-compliant material.,english
"Originally, rules on the non-English editions of Wikipedia were based on a translation of the rules for the English Wikipedia.",english
They have since diverged to some extent.,english
"[67] According to the rules on the English Wikipedia, each entry in Wikipedia must be about a topic that is encyclopedic and is not a dictionary entry or dictionary-style.",english
"[90] A topic should also meet Wikipedia's standards of ""notability"",[91] which generally means that the topic must have been covered in mainstream media or major academic journal sources that are independent of the article's subject.",english
"Further, Wikipedia intends to convey only knowledge that is already established and recognized.",english
[92] It must not present original research.,english
A claim that is likely to be challenged requires a reference to a reliable source.,english
"Among Wikipedia editors, this is often phrased as ""verifiability, not truth"" to express the idea that the readers, not the encyclopedia, are ultimately responsible for checking the truthfulness of the articles and making their own interpretations.",english
"[93] This can at times lead to the removal of information that, though valid, is not properly sourced.",english
"[94] Finally, Wikipedia must not take sides.",english
"[95] All opinions and viewpoints, if attributable to external sources, must enjoy an appropriate share of coverage within an article.",english
This is known as a neutral point of view (NPOV).,english
Wikipedia's initial anarchy integrated democratic and hierarchical elements over time.,english
"[96][97] An article is not considered to be owned by its creator or any other editor, nor by the subject of the article.",english
"[98] Editors in good standing in the community can run for one of many levels of volunteer stewardship: this begins with ""administrator"",[99][100] privileged users who can delete pages, prevent articles from being changed in case of vandalism or editorial disputes (setting protective measures on articles), and try to prevent certain people from editing.",english
"Despite the name, administrators are not supposed to enjoy any special privilege in decision-making; instead, their powers are mostly limited to making edits that have project-wide effects and thus are disallowed to ordinary editors, and to implement restrictions intended to prevent certain persons from making disruptive edits (such as vandalism).",english
"[101][102] Fewer editors become administrators than in years past, in part because the process of vetting potential Wikipedia administrators has become more rigorous.",english
[103] Bureaucrats name new administrators solely upon the recommendations from the community.,english
"Over time, Wikipedia has developed a semi-formal dispute resolution process to assist in such circumstances.",english
"To determine community consensus, editors can raise issues at appropriate community forums,[note 5] or seek outside input through third opinion requests or by initiating a more general community discussion known as a ""request for comment"".",english
The Arbitration Committee presides over the ultimate dispute resolution process.,english
"Although disputes usually arise from a disagreement between two opposing views on how an article should read, the Arbitration Committee explicitly refuses to directly rule on the specific view that should be adopted.",english
"Statistical analyses suggest that the committee ignores the content of disputes and rather focuses on the way disputes are conducted,[104] functioning not so much to resolve disputes and make peace between conflicting editors, but to weed out problematic editors while allowing potentially productive editors back in to participate.",english
"Therefore, the committee does not dictate the content of articles, although it sometimes condemns content changes when it deems the new content violates Wikipedia policies (for example, if the new content is considered biased).",english
"Its remedies include cautions and probations (used in 63% of cases) and banning editors from articles (43%), subject matters (23%), or Wikipedia (16%).",english
Complete bans from Wikipedia are generally limited to instances of impersonation and anti-social behavior.,english
"When conduct is not impersonation or anti-social, but rather anti-consensus or in violation of editing policies, remedies tend to be limited to warnings.",english
"[105] Each article and each user of Wikipedia has an associated ""Talk"" page.",english
"These form the primary communication channel for editors to discuss, coordinate and debate.",english
"[106] Wikipedia's community has been described as cultlike,[107] although not always with entirely negative connotations.",english
"[108] The project's preference for cohesiveness, even if it requires compromise that includes disregard of credentials, has been referred to as ""anti-elitism"".",english
[109] Wikipedians sometimes award one another virtual barnstars for good work.,english
"These personalized tokens of appreciation reveal a wide range of valued work extending far beyond simple editing to include social support, administrative actions, and types of articulation work.",english
[110] Wikipedia does not require that its editors and contributors provide identification.,english
"[111] As Wikipedia grew, ""Who writes Wikipedia?""",english
became one of the questions frequently asked on the project.,english
"[112] Jimmy Wales once argued that only ""a community ... a dedicated group of a few hundred volunteers"" makes the bulk of contributions to Wikipedia and that the project is therefore ""much like any traditional organization"".",english
"[113] In 2008, a Slate magazine article reported that: ""According to researchers in Palo Alto, one percent of Wikipedia users are responsible for about half of the site's edits.",english
"""[114] This method of evaluating contributions was later disputed by Aaron Swartz, who noted that several articles he sampled had large portions of their content (measured by number of characters) contributed by users with low edit counts.",english
"[115] The English Wikipedia has 6,238,672 articles, 40,838,998 registered editors, and 141,020 active editors.",english
An editor is considered active if they have made one or more edits in the past 30 days.,english
"Editors who fail to comply with Wikipedia cultural rituals, such as signing talk page comments, may implicitly signal that they are Wikipedia outsiders, increasing the odds that Wikipedia insiders may target or discount their contributions.",english
"Becoming a Wikipedia insider involves non-trivial costs: the contributor is expected to learn Wikipedia-specific technological codes, submit to a sometimes convoluted dispute resolution process, and learn a ""baffling culture rich with in-jokes and insider references"".",english
"[116] Editors who do not log in are in some sense second-class citizens on Wikipedia,[116] as ""participants are accredited by members of the wiki community, who have a vested interest in preserving the quality of the work product, on the basis of their ongoing participation"",[117] but the contribution histories of anonymous unregistered editors recognized only by their IP addresses cannot be attributed to a particular editor with certainty.",english
"A 2007 study by researchers from Dartmouth College found that ""anonymous and infrequent contributors to Wikipedia [...] are as reliable a source of knowledge as those contributors who register with the site"".",english
"[118] Jimmy Wales stated in 2009 that ""[I]t turns out over 50% of all the edits are done by just .7% of the users ... 524 people ... And in fact, the most active 2%, which is 1400 people, have done 73.4% of all the edits.",english
"""[113] However, Business Insider editor and journalist Henry Blodget showed in 2009 that in a random sample of articles, most content in Wikipedia (measured by the amount of contributed text that survives to the latest sampled edit) is created by ""outsiders"", while most editing and formatting is done by ""insiders"".",english
"[113] A 2008 study found that Wikipedians were less agreeable, open, and conscientious than others,[119][120] although a later commentary pointed out serious flaws, including that the data showed higher openness and that the differences with the control group and the samples were small.",english
"[121] According to a 2009 study, there is ""evidence of growing resistance from the Wikipedia community to new content"".",english
[122] Several studies have shown that most of the Wikipedia contributors are male.,english
"Notably, the results of a Wikimedia Foundation survey in 2008 showed that only 13 percent of Wikipedia editors were female.",english
"[123] Because of this, universities throughout the United States tried to encourage females to become Wikipedia contributors.",english
"Similarly, many of these universities, including Yale and Brown, gave college credit to students who create or edit an article relating to women in science or technology.",english
"[124] Andrew Lih, a professor and scientist, wrote in The New York Times that the reason he thought the number of male contributors outnumbered the number of females so greatly was because identifying as a woman may expose oneself to ""ugly, intimidating behavior"".",english
[125] Data has shown that Africans are underrepresented among Wikipedia editors.,english
"[126] There are currently 317 language editions of Wikipedia (also called language versions, or simply Wikipedias).",english
"As of January 2021, the six largest, in order of article count, are the English, Cebuano, Swedish, German, French, and Dutch Wikipedias.",english
"[127] The second and third largest Wikipedias owe their position to the article-creating bot Lsjbot, which as of 2013 had created about half the articles in the Swedish Wikipedia, and most of the articles in the Cebuano and Waray Wikipedias.",english
The latter are both languages of the Philippines.,english
"In addition to the top six, twelve other Wikipedias have more than a million articles each (Russian, Italian, Spanish, Polish, Waray, Vietnamese, Japanese, Egyptian Arabic, Chinese, Arabic, Ukrainian and Portuguese), seven more have over 500,000 articles (Persian, Catalan, Serbian, Indonesian, Norwegian (Bokmål), Korean and Finnish), 44 more have over 100,000, and 82 more have over 10,000.",english
"[128][129] The largest, the English Wikipedia, has over 6.2 million articles.",english
"As of January 2019[update], according to Alexa, the English subdomain (en.wikipedia.org; English Wikipedia) receives approximately 57% of Wikipedia's cumulative traffic, with the remaining split among the other languages (Russian: 9%; Chinese: 6%; Japanese: 6%; Spanish: 5%).",english
"[3] Distribution of the 55,727,399 articles in different language editions (as of January 30, 2021)[130] The unit for the numbers in bars is articles.",english
"Since Wikipedia is based on the Web and therefore worldwide, contributors to the same language edition may use different dialects or may come from different countries (as is the case for the English edition).",english
These differences may lead to some conflicts over spelling differences (e.g.,english
colour versus color)[132] or points of view.,english
"[133] Though the various language editions are held to global policies such as ""neutral point of view"", they diverge on some points of policy and practice, most notably on whether images that are not licensed freely may be used under a claim of fair use.",english
"[134][135][136] Jimmy Wales has described Wikipedia as ""an effort to create and distribute a free encyclopedia of the highest possible quality to every single person on the planet in their own language"".",english
"[137] Though each language edition functions more or less independently, some efforts are made to supervise them all.",english
"They are coordinated in part by Meta-Wiki, the Wikimedia Foundation's wiki devoted to maintaining all its projects (Wikipedia and others).",english
"[138] For instance, Meta-Wiki provides important statistics on all language editions of Wikipedia,[139] and it maintains a list of articles every Wikipedia should have.",english
"[140] The list concerns basic content by subject: biography, history, geography, society, culture, science, technology, and mathematics.",english
It is not rare for articles strongly related to a particular language not to have counterparts in another edition.,english
"For example, articles about small towns in the United States might be available only in English, even when they meet the notability criteria of other language Wikipedia projects.",english
"Translated articles represent only a small portion of articles in most editions, in part because those editions do not allow fully automated translation of articles.",english
"[142] Articles available in more than one language may offer ""interwiki links"", which link to the counterpart articles in other editions.",english
A study published by PLOS One in 2012 also estimated the share of contributions to different editions of Wikipedia from different regions of the world.,english
"It reported that the proportion of the edits made from North America was 51% for the English Wikipedia, and 25% for the simple English Wikipedia.",english
"[141] On March 1, 2014, The Economist, in an article titled ""The Future of Wikipedia"", cited a trend analysis concerning data published by the Wikimedia Foundation stating that ""[t]he number of editors for the English-language version has fallen by a third in seven years.",english
"""[143] The attrition rate for active editors in English Wikipedia was cited by The Economist as substantially in contrast to statistics for Wikipedia in other languages (non-English Wikipedia).",english
"The Economist reported that the number of contributors with an average of five or more edits per month was relatively constant since 2008 for Wikipedia in other languages at approximately 42,000 editors within narrow seasonal variances of about 2,000 editors up or down.",english
"The number of active editors in English Wikipedia, by sharp comparison, was cited as peaking in 2007 at approximately 50,000 and dropping to 30,000 by the start of 2014.",english
"Should this attrition have continued unabated at the quoted trend rate of approximately 20,000 editors lost within seven years, by 2021 there would be only 10,000 active editors on English Wikipedia.",english
"[143] In contrast, the trend analysis published in The Economist presents Wikipedia in other languages (non-English Wikipedia) as successful in retaining their active editors on a renewable and sustained basis, with their numbers remaining relatively constant at approximately 42,000.",english
[143] No comment was made concerning which of the differentiated edit policy standards from Wikipedia in other languages (non-English Wikipedia) would provide a possible alternative to English Wikipedia for effectively ameliorating substantial editor attrition rates on the English-language Wikipedia.,english
"[144] Various Wikipedians have criticized Wikipedia's large and growing regulation, which includes more than fifty policies and nearly 150,000 words as of 2014[update].",english
[145][146] Critics have stated that Wikipedia exhibits systemic bias.,english
"In 2010, columnist and journalist Edwin Black described Wikipedia as being a mixture of ""truth, half-truth, and some falsehoods"".",english
"[147] Articles in The Chronicle of Higher Education and The Journal of Academic Librarianship have criticized Wikipedia's Undue Weight policy, concluding that the fact that Wikipedia explicitly is not designed to provide correct information about a subject, but rather focus on all the major viewpoints on the subject, give less attention to minor ones, and creates omissions that can lead to false beliefs based on incomplete information.",english
"[148][149][150] Journalists Oliver Kamm and Edwin Black alleged (in 2010 and 2011 respectively) that articles are dominated by the loudest and most persistent voices, usually by a group with an ""ax to grind"" on the topic.",english
"[147][151] A 2008 article in Education Next Journal concluded that as a resource about controversial topics, Wikipedia is subject to manipulation and spin.",english
"[152] In 2006, the Wikipedia Watch criticism website listed dozens of examples of plagiarism in the English Wikipedia.",english
"[153] Articles for traditional encyclopedias such as Encyclopædia Britannica are carefully and deliberately written by experts, lending such encyclopedias a reputation for accuracy.",english
"[154] However, a peer review in 2005 of forty-two scientific entries on both Wikipedia and Encyclopædia Britannica by the science journal Nature found few differences in accuracy, and concluded that ""the average science entry in Wikipedia contained around four inaccuracies; Britannica, about three.",english
"""[155] Joseph Reagle suggested that while the study reflects ""a topical strength of Wikipedia contributors"" in science articles, ""Wikipedia may not have fared so well using a random sampling of articles or on humanities subjects.",english
"""[156] Others raised similar critiques.",english
"[157] The findings by Nature were disputed by Encyclopædia Britannica,[158][159] and in response, Nature gave a rebuttal of the points raised by Britannica.",english
"[160] In addition to the point-for-point disagreement between these two parties, others have examined the sample size and selection method used in the Nature effort, and suggested a ""flawed study design"" (in Nature's manual selection of articles, in part or in whole, for comparison), absence of statistical analysis (e.g., of reported confidence intervals), and a lack of study ""statistical power"" (i.e., owing to small sample size, 42 or 4 × 101 articles compared, vs >105 and >106 set sizes for Britannica and the English Wikipedia, respectively).",english
"[161] As a consequence of the open structure, Wikipedia ""makes no guarantee of validity"" of its content, since no one is ultimately responsible for any claims appearing in it.",english
"[162] Concerns have been raised by PC World in 2009 regarding the lack of accountability that results from users' anonymity,[163] the insertion of false information,[164] vandalism, and similar problems.",english
"Economist Tyler Cowen wrote: ""If I had to guess whether Wikipedia or the median refereed journal article on economics was more likely to be true after a not so long think I would opt for Wikipedia.""",english
"He comments that some traditional sources of non-fiction suffer from systemic biases and novel results, in his opinion, are over-reported in journal articles and relevant information is omitted from news reports.",english
"However, he also cautions that errors are frequently found on Internet sites and that academics and experts must be vigilant in correcting them.",english
[165] Critics argue that Wikipedia's open nature and a lack of proper sources for most of the information makes it unreliable.,english
"[166] Some commentators suggest that Wikipedia may be reliable, but that the reliability of any given article is not clear.",english
[167] Editors of traditional reference works such as the Encyclopædia Britannica have questioned the project's utility and status as an encyclopedia.,english
"[168] Wikipedia co-founder Jimmy Wales has claimed that Wikipedia has largely avoided the problem of ""fake news"" because the Wikipedia community regularly debates the quality of sources in articles.",english
"[169] Wikipedia's open structure inherently makes it an easy target for Internet trolls, spammers, and various forms of paid advocacy seen as counterproductive to the maintenance of a neutral and verifiable online encyclopedia.",english
"[70][171]
In response to paid advocacy editing and undisclosed editing issues, Wikipedia was reported in an article in The Wall Street Journal, to have strengthened its rules and laws against undisclosed editing.",english
"[172] The article stated that: ""Beginning Monday [from the date of the article, June 16, 2014], changes in Wikipedia's terms of use will require anyone paid to edit articles to disclose that arrangement.",english
"Katherine Maher, the nonprofit Wikimedia Foundation's chief communications officer, said the changes address a sentiment among volunteer editors that, 'we're not an advertising service; we're an encyclopedia.",english
"'""[172][173][174][175][176] These issues, among others, had been parodied since the first decade of Wikipedia, notably by Stephen Colbert on The Colbert Report.",english
"[177] A Harvard law textbook, Legal Research in a Nutshell (2011), cites Wikipedia as a ""general source"" that ""can be a real boon"" in ""coming up to speed in the law governing a situation"" and, ""while not authoritative, can provide basic facts as well as leads to more in-depth resources"".",english
"[178] Most university lecturers discourage students from citing any encyclopedia in academic work, preferring primary sources;[179] some specifically prohibit Wikipedia citations.",english
"[180][181] Wales stresses that encyclopedias of any type are not usually appropriate to use as citable sources, and should not be relied upon as authoritative.",english
[182] Wales once (2006 or earlier) said he receives about ten emails weekly from students saying they got failing grades on papers because they cited Wikipedia; he told the students they got what they deserved.,english
"""For God's sake, you're in college; don't cite the encyclopedia,"" he said.",english
"[183] In February 2007, an article in The Harvard Crimson newspaper reported that a few of the professors at Harvard University were including Wikipedia articles in their syllabi, although without realizing the articles might change.",english
"[184] In June 2007, former president of the American Library Association Michael Gorman condemned Wikipedia, along with Google,[185] stating that academics who endorse the use of Wikipedia are ""the intellectual equivalent of a dietitian who recommends a steady diet of Big Macs with everything"".",english
"In contrast, academic writing[clarification needed] in Wikipedia has evolved in recent years and has been found to increase student interest, personal connection to the product, creativity in material processing, and international collaboration in the learning process.",english
"[186] On March 5, 2014, Julie Beck writing for The Atlantic magazine in an article titled ""Doctors' #1 Source for Healthcare Information: Wikipedia"", stated that ""Fifty percent of physicians look up conditions on the (Wikipedia) site, and some are editing articles themselves to improve the quality of available information.",english
"""[187] Beck continued to detail in this article new programs of Amin Azzam at the University of San Francisco to offer medical school courses to medical students for learning to edit and improve Wikipedia articles on health-related issues, as well as internal quality control programs within Wikipedia organized by James Heilman to improve a group of 200 health-related articles of central medical importance up to Wikipedia's highest standard of articles using its Featured Article and Good Article peer-review evaluation process.",english
"[187] In a May 7, 2014, follow-up article in The Atlantic titled ""Can Wikipedia Ever Be a Definitive Medical Text?",english
""", Julie Beck quotes WikiProject Medicine's James Heilman as stating: ""Just because a reference is peer-reviewed doesn't mean it's a high-quality reference.",english
