text,language
"[282] Several languages of Wikipedia also maintain a reference desk, where volunteers answer questions from the general public.",english
"According to a study by Pnina Shachaf in the Journal of Documentation, the quality of the Wikipedia reference desk is comparable to a standard library reference desk, with an accuracy of 55 percent.",english
[283] Wikipedia's original medium was for users to read and edit content using any standard web browser through a fixed Internet connection.,english
"Although Wikipedia content has been accessible through the mobile web since July 2013, The New York Times on February 9, 2014, quoted Erik Möller, deputy director of the Wikimedia Foundation, stating that the transition of internet traffic from desktops to mobile devices was significant and a cause for concern and worry.",english
"[8] The article in The New York Times reported the comparison statistics for mobile edits stating that, ""Only 20 percent of the readership of the English-language Wikipedia comes via mobile devices, a figure substantially lower than the percentage of mobile traffic for other media sites, many of which approach 50 percent.",english
And the shift to mobile editing has lagged even more.,english
"""[8] The New York Times reports that Möller has assigned ""a team of 10 software developers focused on mobile"", out of a total of approximately 200 employees working at the Wikimedia Foundation.",english
"One principal concern cited by The New York Times for the ""worry"" is for Wikipedia to effectively address attrition issues with the number of editors which the online encyclopedia attracts to edit and maintain its content in a mobile access environment.",english
[8] Bloomberg Businessweek reported in July 2014 that Google's Android mobile apps have dominated the largest share of global smartphone shipments for 2013 with 78.6% of market share over their next closest competitor in iOS with 15.2% of the market.,english
"[284] At the time of the Tretikov appointment and her posted web interview with Sue Gardner in May 2014, Wikimedia representatives made a technical announcement concerning the number of mobile access systems in the market seeking access to Wikipedia.",english
"Directly after the posted web interview, the representatives stated that Wikimedia would be applying an all-inclusive approach to accommodate as many mobile access systems as possible in its efforts for expanding general mobile access, including BlackBerry and the Windows Phone system, making market share a secondary issue.",english
"[228] The latest version of the Android app for Wikipedia was released on July 23, 2014, to generally positive reviews, scoring over four of a possible five in a poll of approximately 200,000 users downloading from Google.",english
"[285] The latest version for iOS was released on April 3, 2013, to similar reviews.",english
"[286] Access to Wikipedia from mobile phones was possible as early as 2004, through the Wireless Application Protocol (WAP), via the Wapedia service.",english
"In June 2007 Wikipedia launched en.mobile.wikipedia.org, an official website for wireless devices.",english
"In 2009 a newer mobile service was officially released,[287] located at en.m.wikipedia.org, which caters to more advanced mobile devices such as the iPhone, Android-based devices or WebOS-based devices.",english
Several other methods of mobile access to Wikipedia have emerged.,english
"Many devices and applications optimize or enhance the display of Wikipedia content for mobile devices, while some also incorporate additional features such as use of Wikipedia metadata (see Wikipedia:Metadata), such as geoinformation.",english
[288][289] Wikipedia Zero was an initiative of the Wikimedia Foundation to expand the reach of the encyclopedia to the developing countries.,english
[290] It was discontinued in February 2018.,english
[291] Andrew Lih and Andrew Brown both maintain editing Wikipedia with smartphones is difficult and this discourages new potential contributors.,english
The number of Wikipedia editors has been declining after several years and Tom Simonite of MIT Technology Review claims the bureaucratic structure and rules are a factor in this.,english
Simonite alleges some Wikipedians use the labyrinthine rules and guidelines to dominate others and those editors have a vested interest in keeping the status quo.,english
[43] Lih alleges there is a serious disagreement among existing contributors on how to resolve this.,english
Lih fears for Wikipedia's long-term future while Brown fears problems with Wikipedia will remain and rival encyclopedias will not replace it.,english
"[292][293] In 2017–18, after a barrage of false news reports, both Facebook and YouTube announced they would rely on Wikipedia to help their users evaluate reports and reject false news.",english
"Noam Cohen, writing in The Washington Post states, ""YouTube's reliance on Wikipedia to set the record straight builds on the thinking of another fact-challenged platform, the Facebook social network, which announced last year that Wikipedia would help its users root out 'fake news'.",english
"""[12] As of November 2020, Alexa records the daily pageviews per visitor as 3.03 and the average daily time on site as 3:46 minutes.",english
"[3] In February 2014, The New York Times reported that Wikipedia was ranked fifth globally among all websites, stating ""With 18 billion page views and nearly 500 million unique visitors a month [...] Wikipedia trails just Yahoo, Facebook, Microsoft and Google, the largest with 1.2 billion unique visitors.",english
"""[8] However, its ranking dropped to 13th globally by June 2020 due mostly to a rise in popularity of Chinese websites for online shopping.",english
"[294] In addition to logistic growth in the number of its articles,[295] Wikipedia has steadily gained status as a general reference website since its inception in 2001.",english
"[296] About 50 percent of search engine traffic to Wikipedia comes from Google,[297] a good portion of which is related to academic research.",english
[298] The number of readers of Wikipedia worldwide reached 365 million at the end of 2009.,english
[299] The Pew Internet and American Life project found that one third of US Internet users consulted Wikipedia.,english
[300] In 2011 Business Insider gave Wikipedia a valuation of $4 billion if it ran advertisements.,english
"[301] According to ""Wikipedia Readership Survey 2011"", the average age of Wikipedia readers is 36, with a rough parity between genders.",english
"Almost half of Wikipedia readers visit the site more than five times a month, and a similar number of readers specifically look for Wikipedia in search engine results.",english
About 47 percent of Wikipedia readers do not realize that Wikipedia is a non-profit organization.,english
"[302] During the COVID-19 pandemic, Wikipedia's coverage of the pandemic received international media attention, and brought an increase in Wikipedia readership overall.",english
"[303] Wikipedia's content has also been used in academic studies, books, conferences, and court cases.",english
"[304][305][306] The Parliament of Canada's website refers to Wikipedia's article on same-sex marriage in the ""related links"" section of its ""further reading"" list for the Civil Marriage Act.",english
[307] The encyclopedia's assertions are increasingly used as a source by organizations such as the US federal courts and the World Intellectual Property Organization[308]—though mainly for supporting information rather than information decisive to a case.,english
[309] Content appearing on Wikipedia has also been cited as a source and referenced in some US intelligence agency reports.,english
"[310] In December 2008, the scientific journal RNA Biology launched a new section for descriptions of families of RNA molecules and requires authors who contribute to the section to also submit a draft article on the RNA family for publication in Wikipedia.",english
"[311] Wikipedia has also been used as a source in journalism,[312][313] often without attribution, and several reporters have been dismissed for plagiarizing from Wikipedia.",english
"[314][315][316] In 2006, Time magazine recognized Wikipedia's participation (along with YouTube, Reddit, MySpace, and Facebook)[317] in the rapid growth of online collaboration and interaction by millions of people worldwide.",english
"In July 2007, Wikipedia was the focus of a 30-minute documentary on BBC Radio 4[318] which argued that, with increased usage and awareness, the number of references to Wikipedia in popular culture is such that the word is one of a select group of 21st-century nouns that are so familiar (Google, Facebook, YouTube) that they no longer need explanation.",english
"On September 28, 2007, Italian politician Franco Grillini raised a parliamentary question with the minister of cultural resources and activities about the necessity of freedom of panorama.",english
"He said that the lack of such freedom forced Wikipedia, ""the seventh most consulted website"", to forbid all images of modern Italian buildings and art, and claimed this was hugely damaging to tourist revenues.",english
"[319] On September 16, 2007, The Washington Post reported that Wikipedia had become a focal point in the 2008 US election campaign, saying: ""Type a candidate's name into Google, and among the first results is a Wikipedia page, making those entries arguably as important as any ad in defining a candidate.",english
"Already, the presidential entries are being edited, dissected and debated countless times each day.",english
"""[320] An October 2007 Reuters article, titled ""Wikipedia page the latest status symbol"", reported the recent phenomenon of how having a Wikipedia article vindicates one's notability.",english
[321] Active participation also has an impact.,english
Law students have been assigned to write Wikipedia articles as an exercise in clear and succinct writing for an uninitiated audience.,english
"[322] A working group led by Peter Stone (formed as a part of the Stanford-based project One Hundred Year Study on Artificial Intelligence) in its report called Wikipedia ""the best-known example of crowdsourcing ... that far exceeds traditionally-compiled information sources, such as encyclopedias and dictionaries, in scale and depth.",english
"""[323] In a 2017 opinion piece for Wired, Hossein Derakhshan describes Wikipedia as ""one of the last remaining pillars of the open and decentralized web"" and contrasted its existence as a text-based source of knowledge with social media and social networking services, the latter having ""since colonized the web for television's values"".",english
"For Derakhshan, Wikipedia's goal as an encyclopedia represents the Age of Enlightenment tradition of rationality triumphing over emotions, a trend which he considers ""endangered"" due to the ""gradual shift from a typographic culture to a photographic one, which in turn mean[s] a shift from rationality to emotions, exposition to entertainment"".",english
"Rather than ""sapere aude"" (lit.",english
"''dare to know''), social networks have led to a culture of ""[d]are not to care to know"".",english
"This is while Wikipedia faces ""a more concerning problem"" than funding, namely ""a flattening growth rate in the number of contributors to the website"".",english
"Consequently, the challenge for Wikipedia and those who use it is to ""save Wikipedia and its promise of a free and open collection of all human knowledge amid the conquest of new and old television—how to collect and preserve knowledge when nobody cares to know.",english
"""[324] Wikipedia won two major awards in May 2004.",english
"[325] The first was a Golden Nica for Digital Communities of the annual Prix Ars Electronica contest; this came with a €10,000 (£6,588; $12,700) grant and an invitation to present at the PAE Cyberarts Festival in Austria later that year.",english
"The second was a Judges' Webby Award for the ""community"" category.",english
"[326] Wikipedia was also nominated for a ""Best Practices"" Webby award.",english
"In 2007, readers of brandchannel.com voted Wikipedia as the fourth-highest brand ranking, receiving 15 percent of the votes in answer to the question ""Which brand had the most impact on our lives in 2006?",english
"""[327] In September 2008, Wikipedia received Quadriga A Mission of Enlightenment award of Werkstatt Deutschland along with Boris Tadić, Eckart Höfling, and Peter Gabriel.",english
The award was presented to Wales by David Weinberger.,english
"[328] In 2015, Wikipedia was awarded both the annual Erasmus Prize, which recognizes exceptional contributions to culture, society or social sciences,[329] and the Spanish Princess of Asturias Award on International Cooperation.",english
"[330] Speaking at the Asturian Parliament in Oviedo, the city that hosts the awards ceremony, Jimmy Wales praised the work of the Asturian language Wikipedia users.",english
"[331] The night of the ceremony, members of the Wikimedia Foundation held a meeting with Wikipedians from all parts of Spain, including the local Asturian community.",english
"Many parodies target Wikipedia's openness and susceptibility to inserted inaccuracies, with characters vandalizing or modifying the online encyclopedia project's articles.",english
"Comedian Stephen Colbert has parodied or referenced Wikipedia on numerous episodes of his show The Colbert Report and coined the related term wikiality, meaning ""together we can create a reality that we all agree on—the reality we just agreed on"".",english
"[177] Another example can be found in ""Wikipedia Celebrates 750 Years of American Independence"", a July 2006 front-page article in The Onion,[332] as well as the 2010 The Onion article ""'L.A.",english
"Law' Wikipedia Page Viewed 874 Times Today"".",english
"[333] In an episode of the television comedy The Office U.S., which aired in April 2007, an incompetent office manager (Michael Scott) is shown relying on a hypothetical Wikipedia article for information on negotiation tactics to assist him in negotiating lesser pay for an employee.",english
"[334] Viewers of the show tried to add the episode's mention of the page as a section of the actual Wikipedia article on negotiation, but this effort was prevented by other users on the article's talk page.",english
"[335] ""My Number One Doctor"", a 2007 episode of the television show Scrubs, played on the perception that Wikipedia is an unreliable reference tool with a scene in which Perry Cox reacts to a patient who says that a Wikipedia article indicates that the raw food diet reverses the effects of bone cancer by retorting that the same editor who wrote that article also wrote the Battlestar Galactica episode guide.",english
"[336] In 2008, the comedic website CollegeHumor produced a video sketch named ""Professor Wikipedia"", in which the fictitious Professor Wikipedia instructs a class with a medley of unverifiable and occasionally absurd statements.",english
"[337] The Dilbert comic strip from May 8, 2009, features a character supporting an improbable claim by saying ""Give me ten minutes and then check Wikipedia.",english
"""[338] In July 2009, BBC Radio 4 broadcast a comedy series called Bigipedia, which was set on a website which was a parody of Wikipedia.",english
Some of the sketches were directly inspired by Wikipedia and its articles.,english
"[339] On August 23, 2013, the New Yorker website published a cartoon with this caption: ""Dammit, Manning, have you considered the pronoun war that this is going to start on your Wikipedia page?",english
"""[340] The cartoon referred to Chelsea Elizabeth Manning (born Bradley Edward Manning), an American activist, politician, and former United States Army soldier and a trans woman.",english
"In December 2015, John Julius Norwich stated, in a letter published in The Times newspaper, that as a historian he resorted to Wikipedia ""at least a dozen times a day"", and had never yet caught it out.",english
"He described it as ""a work of reference as useful as any in existence"", with so wide a range that it is almost impossible to find a person, place, or thing that it has left uncovered and that he could never have written his last two books without it.",english
"[341][342] Wikipedia has also spawned several sister projects, which are also wikis run by the Wikimedia Foundation.",english
"These other Wikimedia projects include Wiktionary, a dictionary project launched in December 2002,[343] Wikiquote, a collection of quotations created a week after Wikimedia launched, Wikibooks, a collection of collaboratively written free textbooks and annotated texts, Wikimedia Commons, a site devoted to free-knowledge multimedia, Wikinews, for citizen journalism, and Wikiversity, a project for the creation of free learning materials and the provision of online learning activities.",english
"[344] Another sister project of Wikipedia, Wikispecies, is a catalogue of species.",english
"In 2012 Wikivoyage, an editable travel guide, and Wikidata, an editable knowledge base, launched.",english
"The most obvious economic effect of Wikipedia has been the death of commercial encyclopedias, especially the printed versions, e.g.",english
"Encyclopædia Britannica, which were unable to compete with a product that is essentially free.",english
"[345][346][347] Nicholas Carr wrote a 2005 essay, ""The amorality of Web 2.0"", that criticized websites with user-generated content, like Wikipedia, for possibly leading to professional (and, in his view, superior) content producers' going out of business, because ""free trumps quality all the time"".",english
"Carr wrote: ""Implicit in the ecstatic visions of Web 2.0 is the hegemony of the amateur.",english
I for one can't imagine anything more frightening.,english
"""[348] Others dispute the notion that Wikipedia, or similar efforts, will entirely displace traditional publications.",english
"For instance, Chris Anderson, the editor-in-chief of Wired Magazine, wrote in Nature that the ""wisdom of crowds"" approach of Wikipedia will not displace top scientific journals, with their rigorous peer review process.",english
[349] There is also an ongoing debate about the influence of Wikipedia on the biography publishing business.,english
"""The worry is that, if you can get all that information from Wikipedia, what's left for biography?""",english
"said Kathryn Hughes, professor of life writing at the University of East Anglia and author of The Short Life and Long Times of Mrs Beeton and George Eliot: the Last Victorian.",english
"[350] Wikipedia has been widely used as a corpus for linguistic research in computational linguistics, information retrieval and natural language processing.",english
"In particular, it commonly serves as a target knowledge base for the entity linking problem, which is then called ""wikification"",[351] and to the related problem of word-sense disambiguation.",english
"[352] Methods similar to wikification can in turn be used to find ""missing"" links in Wikipedia.",english
"[353] In 2015, French researchers José Lages of the University of Franche-Comté in Besançon and Dima Shepelyansky of Paul Sabatier University in Toulouse published a global university ranking based on Wikipedia scholarly citations.",english
"[354][355][356] They used PageRank ""followed by the number of appearances in the 24 different language editions of Wikipedia (descending order) and the century in which they were founded (ascending order)"".",english
[356] A 2017 MIT study suggests that words used on Wikipedia articles end up in scientific publications.,english
[357][358] Studies related to Wikipedia have been using machine learning and artificial intelligence to support various operations.,english
One of the most important areas—automatic detection of vandalism[359][360] and data quality assessment in Wikipedia.,english
[361] Several interactive multimedia encyclopedias incorporating entries written by the public existed long before Wikipedia was founded.,english
"The first of these was the 1986 BBC Domesday Project, which included text (entered on BBC Micro computers) and photographs from more than a million contributors in the UK, and covered the geography, art, and culture of the UK.",english
"This was the first interactive multimedia encyclopedia (and was also the first major multimedia document connected through internal links), with the majority of articles being accessible through an interactive map of the UK.",english
The user interface and part of the content of the Domesday Project were emulated on a website until 2008.,english
"[362] Several free-content, collaborative encyclopedias were created around the same period as Wikipedia (e.g.",english
"Everything2),[363] with many later being merged into the project (e.g.",english
GNE).,english
"[364] One of the most successful early online encyclopedias incorporating entries by the public was h2g2, which was created by Douglas Adams in 1999.",english
"The h2g2 encyclopedia is relatively lighthearted, focusing on articles which are both witty and informative.",english
Subsequent collaborative knowledge websites have drawn inspiration from Wikipedia.,english
"Some, such as Susning.nu, Enciclopedia Libre, Hudong, and Baidu Baike likewise employ no formal review process, although some like Conservapedia are not as open.",english
"Others use more traditional peer review, such as Encyclopedia of Life and the online wiki encyclopedias Scholarpedia and Citizendium.",english
The latter was started by Sanger in an attempt to create a reliable alternative to Wikipedia.,english
[365][366] Machine learning (ML) is the study of computer algorithms that improve automatically through experience.,english
[1] It is seen as a part of artificial intelligence.,english
"Machine learning algorithms build a model based on sample data, known as ""training data"", in order to make predictions or decisions without being explicitly programmed to do so.",english
"[2] Machine learning algorithms are used in a wide variety of applications, such as email filtering and computer vision, where it is difficult or unfeasible to develop conventional algorithms to perform the needed tasks.",english
"A subset of machine learning is closely related to computational statistics, which focuses on making predictions using computers; but not all machine learning is statistical learning.",english
"The study of mathematical optimization delivers methods, theory and application domains to the field of machine learning.",english
"Data mining is a related field of study, focusing on exploratory data analysis through unsupervised learning.",english
"[4][5] In its application across business problems, machine learning is also referred to as predictive analytics.",english
Machine learning involves computers discovering how they can perform tasks without being explicitly programmed to do so.,english
It involves computers learning from data provided so that they carry out certain tasks.,english
"For simple tasks assigned to computers, it is possible to program algorithms telling the machine how to execute all steps required to solve the problem at hand; on the computer's part, no learning is needed.",english
"For more advanced tasks, it can be challenging for a human to manually create the needed algorithms.",english
"In practice, it can turn out to be more effective to help the machine develop its own algorithm, rather than having human programmers specify every needed step.",english
[6] The discipline of machine learning employs various approaches to teach computers to accomplish tasks where no fully satisfactory algorithm is available.,english
"In cases where vast numbers of potential answers exist, one approach is to label some of the correct answers as valid.",english
This can then be used as training data for the computer to improve the algorithm(s) it uses to determine correct answers.,english
"For example, to train a system for the task of digital character recognition, the MNIST dataset of handwritten digits has often been used.",english
"[6] Machine learning approaches are traditionally divided into three broad categories, depending on the nature of the ""signal"" or ""feedback"" available to the learning system: Other approaches have been developed which don't fit neatly into this three-fold categorisation, and sometimes more than one is used by the same machine learning system.",english
"For example topic modeling, dimensionality reduction or meta learning.",english
"[7] As of 2020, deep learning has become the dominant approach for much ongoing work in the field of machine learning.",english
"[6] The term machine learning was coined in 1959 by Arthur Samuel, an American IBMer and pioneer in the field of computer gaming and artificial intelligence.",english
"[8][9] A representative book of the machine learning research during the 1960s was the Nilsson's book on Learning Machines, dealing mostly with machine learning for pattern classification.",english
"[10] Interest related to pattern recognition continued into the 1970s, as described by Duda and Hart in 1973.",english
"[11] In 1981 a report was given on using teaching strategies so that a neural network learns to recognize 40 characters (26 letters, 10 digits, and 4 special symbols) from a computer terminal.",english
