text,language
"[12] Tom M. Mitchell provided a widely quoted, more formal definition of the algorithms studied in the machine learning field: ""A computer program is said to learn from experience E with respect to some class of tasks T and performance measure P if its performance at tasks in T, as measured by P,  improves with experience E.""[13] This definition of the tasks in which machine learning is concerned offers a fundamentally operational definition rather than defining the field in cognitive terms.",english
"This follows Alan Turing's proposal in his paper ""Computing Machinery and Intelligence"", in which the question ""Can machines think?""",english
"is replaced with the question ""Can machines do what we (as thinking entities) can do?"".",english
"[14] Modern day machine learning has two objectives, one is to classify data based on models which have been developed, the other purpose is to make predictions for future outcomes based on these models.",english
A hypothetical algorithm specific to classifying data may use computer vision of moles coupled with supervised learning in order to train it to classify the cancerous moles.,english
"Where as, a machine learning algorithm for stock trading may inform the trader of future potential predictions.",english
"[15] As a scientific endeavor, machine learning grew out of the quest for artificial intelligence.",english
"In the early days of AI as an academic discipline, some researchers were interested in having machines learn from data.",english
"They attempted to approach the problem with various symbolic methods, as well as what was then termed ""neural networks""; these were mostly perceptrons and other models that were later found to be reinventions of the generalized linear models of statistics.",english
"[18] Probabilistic reasoning was also employed, especially in automated medical diagnosis.",english
"[19]:488 However, an increasing emphasis on the logical, knowledge-based approach caused a rift between AI and machine learning.",english
Probabilistic systems were plagued by theoretical and practical problems of data acquisition and representation.,english
"[19]:488 By 1980, expert systems had come to dominate AI, and statistics was out of favor.",english
"[20] Work on symbolic/knowledge-based learning did continue within AI, leading to inductive logic programming, but the more statistical line of research was now outside the field of AI proper, in pattern recognition and information retrieval.",english
[19]:708–710; 755 Neural networks research had been abandoned by AI and computer science around the same time.,english
"This line, too, was continued outside the AI/CS field, as ""connectionism"", by researchers from other disciplines including Hopfield, Rumelhart and Hinton.",english
Their main success came in the mid-1980s with the reinvention of backpropagation.,english
"[19]:25 Machine learning (ML), reorganized as a separate field, started to flourish in the 1990s.",english
The field changed its goal from achieving artificial intelligence to tackling solvable problems of a practical nature.,english
"It shifted focus away from the symbolic approaches it had inherited from AI, and toward methods and models borrowed from statistics and probability theory.",english
"[20] As of 2020, many sources continue to assert that machine learning remains a subfield of AI.",english
"[21][22][16] The main disagreement is whether all of ML is part of AI, as this would mean that anyone using ML could claim they are using AI.",english
Others have the view that not all of ML is part of AI[23][24][25] where only an 'intelligent' subset of ML is part of AI.,english
[26] The question to what is the difference between ML and AI is answered by Judea Pearl in The Book of Why.,english
"[27] Accordingly ML learns and predicts based on passive observations, whereas AI implies an agent  interacting with the environment to learn and take actions that maximize its chance of successfully achieving its goals.",english
"[30] Machine learning and data mining often employ the same methods and overlap significantly, but while machine learning focuses on prediction, based on known properties learned from the training data, data mining focuses on the discovery of (previously) unknown properties in the data (this is the analysis step of knowledge discovery in databases).",english
"Data mining uses many machine learning methods, but with different goals; on the other hand, machine learning also employs data mining methods as ""unsupervised learning"" or as a preprocessing step to improve learner accuracy.",english
"Much of the confusion between these two research communities (which do often have separate conferences and separate journals, ECML PKDD being a major exception) comes from the basic assumptions they work with: in machine learning, performance is usually evaluated with respect to the ability to reproduce known knowledge, while in knowledge discovery and data mining (KDD) the key task is the discovery of previously unknown knowledge.",english
"Evaluated with respect to known knowledge, an uninformed (unsupervised) method will easily be outperformed by other supervised methods, while in a typical KDD task, supervised methods cannot be used due to the unavailability of training data.",english
Machine learning also has intimate ties to optimization: many learning problems are formulated as minimization of some loss function on a training set of examples.,english
"Loss functions express the discrepancy between the predictions of the model being trained and the actual problem instances (for example, in classification, one wants to assign a label to instances, and models are trained to correctly predict the pre-assigned labels of a set of examples).",english
"[31] The difference between optimization and machine learning arises from the goal of generalization: while optimization algorithms can minimize the loss on a training set, machine learning is concerned with minimizing the loss on unseen samples.",english
"Characterizing the generalization of various learning algorithms is an active topic of current research, especially for deep learning algorithms.",english
"Machine learning and statistics are closely related fields in terms of methods, but distinct in their principal goal: statistics draws population inferences from a sample, while machine learning finds generalizable predictive patterns.",english
"[32] According to Michael I. Jordan, the ideas of machine learning, from methodological principles to theoretical tools, have had a long pre-history in statistics.",english
[33] He also suggested the term data science as a placeholder to call the overall field.,english
"[33] Leo Breiman distinguished two statistical modeling paradigms: data model and algorithmic model,[34] wherein ""algorithmic model"" means more or less the machine learning algorithms like Random forest.",english
"Some statisticians have adopted methods from machine learning, leading to a combined field that they call statistical learning.",english
[35] A core objective of a learner is to generalize from its experience.,english
"[3][36] Generalization in this context is the ability of a learning machine to perform accurately on new, unseen examples/tasks after having experienced a learning data set.",english
The training examples come from some generally unknown probability distribution (considered representative of the space of occurrences) and the learner has to build a general model about this space that enables it to produce sufficiently accurate predictions in new cases.,english
The computational analysis of machine learning algorithms and their performance is a branch of theoretical computer science known as computational learning theory.,english
"Because training sets are finite and the future is uncertain, learning theory usually does not yield guarantees of the performance of algorithms.",english
"Instead, probabilistic bounds on the performance are quite common.",english
The bias–variance decomposition is one way to quantify generalization error.,english
"For the best performance in the context of generalization, the complexity of the hypothesis should match the complexity of the function underlying the data.",english
"If the hypothesis is less complex than the function, then the model has under fitted the data.",english
"If the complexity of the model is increased in response, then the training error decreases.",english
"But if the hypothesis is too complex, then the model is subject to overfitting and generalization will be poorer.",english
"[37] In addition to performance bounds, learning theorists study the time complexity and feasibility of learning.",english
"In computational learning theory, a computation is considered feasible if it can be done in polynomial time.",english
There are two kinds of time complexity results.,english
Positive results show that a certain class of functions can be learned in polynomial time.,english
Negative results show that certain classes cannot be learned in polynomial time.,english
"The types of machine learning algorithms differ in their approach, the type of data they input and output, and the type of task or problem that they are intended to solve.",english
Supervised learning algorithms build a mathematical model of a set of data that contains both the inputs and the desired outputs.,english
"[38] The data is known as training data, and consists of a set of training examples.",english
"Each training example has one or more inputs and the desired output, also known as a supervisory signal.",english
"In the mathematical model, each training example is represented by an array or vector, sometimes called a feature vector, and the training data is represented by a matrix.",english
"Through iterative optimization of an objective function, supervised learning algorithms learn a function that can be used to predict the output associated with new inputs.",english
[39] An optimal function will allow the algorithm to correctly determine the output for inputs that were not a part of the training data.,english
An algorithm that improves the accuracy of its outputs or predictions over time is said to have learned to perform that task.,english
"[13] Types of supervised learning algorithms include active learning, classification and regression.",english
"[40] Classification algorithms are used when the outputs are restricted to a limited set of values, and regression algorithms are used when the outputs may have any numerical value within a range.",english
"As an example, for a classification algorithm that filters emails, the input would be an incoming email, and the output would be the name of the folder in which to file the email.",english
"Similarity learning is an area of supervised machine learning closely related to regression and classification, but the goal is to learn from examples using a similarity function that measures how similar or related two objects are.",english
"It has applications in ranking, recommendation systems, visual identity tracking, face verification, and speaker verification.",english
"Unsupervised learning algorithms take a set of data that contains only inputs, and find structure in the data, like grouping or clustering of data points.",english
"The algorithms, therefore, learn from test data that has not been labeled, classified or categorized.",english
"Instead of responding to feedback, unsupervised learning algorithms identify commonalities in the data and react based on the presence or absence of such commonalities in each new piece of data.",english
"A central application of unsupervised learning is in the field of density estimation in statistics, such as finding the probability density function.",english
[41] Though unsupervised learning encompasses other domains involving summarizing and explaining data features.,english
"Cluster analysis is the assignment of a set of observations into subsets (called clusters) so that observations within the same cluster are similar according to one or more predesignated criteria, while observations drawn from different clusters are dissimilar.",english
"Different clustering techniques make different assumptions on the structure of the data, often defined by some similarity metric and evaluated, for example, by internal compactness, or the similarity between members of the same cluster, and separation, the difference between clusters.",english
Other methods are based on estimated density and graph connectivity.,english
Semi-supervised learning falls between unsupervised learning (without any labeled training data) and supervised learning (with completely labeled training data).,english
"Some of the training examples are missing training labels,  yet many machine-learning researchers have found that unlabeled data, when used in conjunction with a small amount of labeled data, can produce a considerable improvement in learning accuracy.",english
"In weakly supervised learning, the training labels are noisy, limited, or imprecise; however, these labels are often cheaper to obtain, resulting in larger effective training sets.",english
[42] Reinforcement learning is an area of machine learning concerned with how software agents ought to take actions in an environment so as to maximize some notion of cumulative reward.,english
"Due to its generality, the field is studied in many other disciplines, such as game theory, control theory, operations research, information theory, simulation-based optimization, multi-agent systems, swarm intelligence, statistics and genetic algorithms.",english
"In machine learning, the environment is typically represented as a Markov decision process (MDP).",english
Many reinforcement learning algorithms use dynamic programming techniques.,english
"[43] Reinforcement learning algorithms do not assume knowledge of an exact mathematical model of the MDP, and are used when exact models are infeasible.",english
Reinforcement learning algorithms are used in autonomous vehicles or in learning to play a game against a human opponent.,english
Self-learning as a machine learning paradigm was introduced in 1982 along with a neural network capable of self-learning named crossbar adaptive array (CAA).,english
[44] It is a learning with no external rewards and no external teacher advice.,english
"The CAA self-learning algorithm computes, in a crossbar fashion, both decisions about actions and emotions (feelings) about consequence situations.",english
The system is driven by the interaction between cognition and emotion.,english
"[45]
The self-learning algorithm updates a memory matrix W =||w(a,s)|| such that in each iteration executes the following machine learning routine: It is a system with only one input, situation s, and only one output, action (or behavior) a.",english
There is neither a separate reinforcement input nor an advice input from the environment.,english
The backpropagated value (secondary reinforcement) is the emotion toward the consequence situation.,english
"The CAA exists in two environments, one is the behavioral environment where it behaves, and the other is the genetic environment, wherefrom it initially and only once receives initial emotions about situations to be encountered in the behavioral environment.",english
"After receiving the genome (species) vector from the genetic environment, the CAA learns a goal-seeking behavior, in an environment that contains both desirable and undesirable situations.",english
[46] Several learning algorithms aim at discovering better representations of the inputs provided during training.,english
[47] Classic examples include principal components analysis and cluster analysis.,english
"Feature learning algorithms, also called representation learning algorithms, often attempt to preserve the information in their input but also transform it in a way that makes it useful, often as a pre-processing step before performing classification or predictions.",english
"This technique allows reconstruction of the inputs coming from the unknown data-generating distribution, while not being necessarily faithful to configurations that are implausible under that distribution.",english
"This replaces manual feature engineering, and allows a machine to both learn the features and use them to perform a specific task.",english
Feature learning can be either supervised or unsupervised.,english
"In supervised feature learning, features are learned using labeled input data.",english
"Examples include artificial neural networks, multilayer perceptrons, and supervised dictionary learning.",english
"In unsupervised feature learning, features are learned with unlabeled input data.",english
"Examples include dictionary learning, independent component analysis, autoencoders, matrix factorization[48] and various forms of clustering.",english
[49][50][51] Manifold learning algorithms attempt to do so under the constraint that the learned representation is low-dimensional.,english
"Sparse coding algorithms attempt to do so under the constraint that the learned representation is sparse, meaning that the mathematical model has many zeros.",english
"Multilinear subspace learning algorithms aim to learn low-dimensional representations directly from tensor representations for multidimensional data, without reshaping them into higher-dimensional vectors.",english
"[52] Deep learning algorithms discover multiple levels of representation, or a hierarchy of features, with higher-level, more abstract features defined in terms of (or generating) lower-level features.",english
It has been argued that an intelligent machine is one that learns a representation that disentangles the underlying factors of variation that explain the observed data.,english
[53] Feature learning is motivated by the fact that machine learning tasks such as classification often require input that is mathematically and computationally convenient to process.,english
"However, real-world data such as images, video, and sensory data has not yielded to attempts to algorithmically define specific features.",english
"An alternative is to discover such features or representations thorough examination, without relying on explicit algorithms.",english
"Sparse dictionary learning is a feature learning method where a training example is represented as a linear combination of basis functions, and is assumed to be a sparse matrix.",english
The method is strongly NP-hard and difficult to solve approximately.,english
[54] A popular heuristic method for sparse dictionary learning is the K-SVD algorithm.,english
Sparse dictionary learning has been applied in several contexts.,english
"In classification, the problem is to determine the class to which a previously unseen training example belongs.",english
"For a dictionary where each class has already been built, a new training example is associated with the class that is best sparsely represented by the corresponding dictionary.",english
Sparse dictionary learning has also been applied in image de-noising.,english
"The key idea is that a clean image patch can be sparsely represented by an image dictionary, but the noise cannot.",english
"[55] In data mining, anomaly detection, also known as outlier detection, is the identification of rare items, events or observations which raise suspicions by differing significantly from the majority of the data.",english
"[56] Typically, the anomalous items represent an issue such as bank fraud, a structural defect, medical problems or errors in a text.",english
"Anomalies are referred to as outliers, novelties, noise, deviations and exceptions.",english
"[57] In particular, in the context of abuse and network intrusion detection, the interesting objects are often not rare objects, but unexpected bursts of inactivity.",english
"This pattern does not adhere to the common statistical definition of an outlier as a rare object, and many outlier detection methods (in particular, unsupervised algorithms) will fail on such data unless it has been aggregated appropriately.",english
"Instead, a cluster analysis algorithm may be able to detect the micro-clusters formed by these patterns.",english
[58] Three broad categories of anomaly detection techniques exist.,english
"[59] Unsupervised anomaly detection techniques detect anomalies in an unlabeled test data set under the assumption that the majority of the instances in the data set are normal, by looking for instances that seem to fit least to the remainder of the data set.",english
"Supervised anomaly detection techniques require a data set that has been labeled as ""normal"" and ""abnormal"" and involves training a classifier (the key difference to many other statistical classification problems is the inherently unbalanced nature of outlier detection).",english
Semi-supervised anomaly detection techniques construct a model representing normal behavior from a given normal training data set and then test the likelihood of a test instance to be generated by the model.,english
"In developmental robotics, robot learning algorithms generate their own sequences of learning experiences, also known as a curriculum, to cumulatively acquire new skills through self-guided exploration and social interaction with humans.",english
"These robots use guidance mechanisms such as active learning, maturation, motor synergies and imitation.",english
Association rule learning is a rule-based machine learning method for discovering relationships between variables in large databases.,english
"It is intended to identify strong rules discovered in databases using some measure of ""interestingness"".",english
"[60] Rule-based machine learning is a general term for any machine learning method that identifies, learns, or evolves ""rules"" to store, manipulate or apply knowledge.",english
The defining characteristic of a rule-based machine learning algorithm is the identification and utilization of a set of relational rules that collectively represent the knowledge captured by the system.,english
This is in contrast to other machine learning algorithms that commonly identify a singular model that can be universally applied to any instance in order to make a prediction.,english
"[61] Rule-based machine learning approaches include learning classifier systems, association rule learning, and artificial immune systems.",english
"Based on the concept of strong rules, Rakesh Agrawal, Tomasz Imieliński and Arun Swami introduced association rules for discovering regularities between products in large-scale transaction data recorded by point-of-sale (POS) systems in supermarkets.",english
"[62] For example, the rule 



{

o
n
i
o
n
s
,
p
o
t
a
t
o
e
s

}
⇒
{

b
u
r
g
e
r

}


{\displaystyle \{\mathrm {onions,potatoes} \}\Rightarrow \{\mathrm {burger} \}}

 found in the sales data of a supermarket would indicate that if a customer buys onions and potatoes together, they are likely to also buy hamburger meat.",english
Such information can be used as the basis for decisions about marketing activities such as promotional pricing or product placements.,english
"In addition to market basket analysis, association rules are employed today in application areas including Web usage mining, intrusion detection, continuous production, and bioinformatics.",english
"In contrast with sequence mining, association rule learning typically does not consider the order of items either within a transaction or across transactions.",english
"Learning classifier systems (LCS) are a family of rule-based machine learning algorithms that combine a discovery component, typically a genetic algorithm, with a learning component, performing either supervised learning, reinforcement learning, or unsupervised learning.",english
They seek to identify a set of context-dependent rules that collectively store and apply knowledge in a piecewise manner in order to make predictions.,english
"[63] Inductive logic programming (ILP) is an approach to rule-learning using logic programming as a uniform representation for input examples, background knowledge, and hypotheses.",english
"Given an encoding of the known background knowledge and a set of examples represented as a logical database of facts, an ILP system will derive a hypothesized logic program that entails all positive and no negative examples.",english
"Inductive programming is a related field that considers any kind of programming language for representing hypotheses (and not only logic programming), such as functional programs.",english
Inductive logic programming is particularly useful in bioinformatics and natural language processing.,english
Gordon Plotkin and Ehud Shapiro laid the initial theoretical foundation for inductive machine learning in a logical setting.,english
[64][65][66] Shapiro built their first implementation (Model Inference System) in 1981: a Prolog program that inductively inferred logic programs from positive and negative examples.,english
"[67] The term inductive here refers to philosophical induction, suggesting a theory to explain observed facts, rather than mathematical induction, proving a property for all members of a well-ordered set.",english
"Performing machine learning involves creating a model, which is trained on some training data and then can process additional data to make predictions.",english
Various types of models have been used and researched for machine learning systems.,english
"Artificial neural networks (ANNs), or connectionist systems, are computing systems vaguely inspired by the biological neural networks that constitute animal brains.",english
"Such systems ""learn"" to perform tasks by considering examples, generally without being programmed with any task-specific rules.",english
"An ANN is a model based on a collection of connected units or nodes called ""artificial neurons"", which loosely model the neurons in a biological brain.",english
